idx,block_idx,meta,sentence
0,0,knot,Intravenous Methylprednisolone has an impact on the Qt Interval.
1,1,knot,The Qt Interval has an impact on the level of Potassium.
2,2,knot,Fully Human Single-Domain Antibodies interact with the Upper S1 Region.
3,3,knot,Syndromic Surveillance offers insights on the local level.
4,4,knot,The spread of the virus is monitored using a portable CT scanner.
5,5,knot,Radiation therapy is utilized for treating porcine stomachs.
6,6,knot,Radiation Therapy makes use of the skills of a Highly Experienced Scopist.
7,7,knot,Shortness of breath exacerbates mental health risks.
8,8,knot,Tep is the entity whose long-term surgical outcomes are monitored by.
9,9,knot,Protective Measures serve as safeguards for Eye Protection.
10,10,knot,The E Gene Screening Real-Time Reverse Transcription-Polymerase Chain Reaction (Rrt-Pcr) Assay is utilized for by the Indian Council Of Medical Research (Icmr)-National Institute Of Virology (Niv).
11,11,knot,Topical Therapies are considered complementary to Kidney Transplantation.
12,12,knot,The Stochastic Branching Process Model can be used to simulate the occurrence of dyspnea.
13,13,knot,Research Paradigms informs Diagnostic Strategies in the development of new diagnostic tools and techniques.
14,14,knot,Diagnostic Strategies are used to identify Protracted Bacterial Bronchitis (Pbb).
15,15,knot,Niclosamide Ethanolamine (Nen) undergoes trial with Preclinical And Clinical Evaluation.
16,16,knot,Nsaid modulates the activity of Angiotensin Converting Enzyme-2 (Ace2).
17,17,knot,Anti-Viral Igm targets specific cells within peripheral blood lymphocytes.
18,18,knot,Exacerbation of COPD aggravates the lower respiratory tract.
19,19,knot,The Bruins Slot Rule establishes the threshold for Mbl Cut-Off at greater than 1870 Ng/Ml.
20,20,knot,Charts visually represent the progression of days.
21,21,knot,The German Cancer Society keeps an eye on Fev1 for monitoring purposes.
22,22,knot,The quarantine period may act as a potential trigger for domestic violence and abuse (DVA).
23,23,knot,Non-Coding RNAs play a role in modulating the expression of the proteome.
24,24,knot,Thrombotic Complications are predisposed to by individuals of Black Caribbean descent.
25,25,knot,Cd14++Cd16- Monocytes exhibit a response to Chemo/Radiotherapy.
26,26,knot,Glycemic Control impacts the progression of Syphilis.
27,27,knot,Primary Cortical Neurons extend neurites to establish connections in neural networks.
28,28,knot,Perforin is activated by Cd34+ Human Hematopoietic Progenitor Cells.
29,29,knot,Cardiologists are consulted by workers.
30,30,knot,In vitro cultured Dcs induce endothelial dysfunction.
31,31,knot,News Records provide reports on vaccination side effects.
32,32,knot,No2 triggers the knotth of pulmonary nodules.
33,33,knot,Carcinogenic Products interact with cellular surfaces.
34,34,knot,An expert conducts a sigmoid colectomy.
35,35,knot,3D Multipath Curved Planar Reformations can detect stenosis effectively.
36,36,knot,Procalcitonin levels can indicate the need for suturing in wound closure.
37,37,knot,Β-Selinenol (Ta3) targets the pancreas for therapeutic intervention.
38,38,knot,Ash is exposed to an airborne toxin in the environment that contributes to the development of dementia.
39,39,knot,Dementia exacerbates the severity of shock.
40,40,knot,Naja Atra targets Pro-Tnfα for inhibition.
41,41,knot,The Fossa Of Rosenmüller plays a role in the process of conversion.
42,42,knot,Conversion is a complication of Incarcerated Obturator Hernia.
43,43,knot,White Blood Cell Counts can be indicative of the onset of Critical Illness.
44,44,knot,Flow Cytometry is the method by which Viral Progeny is analyzed.
45,45,knot,The At1R Axis is modulated by Angiotensin-Converting Enzyme (Ace) 2 to regulate signaling.
46,46,knot,The Programmed Death-1 Homolog (Pd-1H) modulates the Population Size.
47,47,knot,"Covid 19, a disease caused by a coronavirus, has a zoonotic origin from New World Arenaviruses."
48,48,knot,Body Temperature Measurement detects Safv.
49,49,knot,Small-Area Lockdowns INDUCE a Crazy Paving Appearance.
